

登記案號,類別,案由,主任,登記號數,收件日期,登記日期,公告日期,登記簿,任期判定,屆期判定,法人代表,法人名稱,設立登記日期,主事務所,目的,捐助方法,許可機關日期,存立時期,財產總額,結案原因,結案日期,歸檔日期,發證日期,送達代收人姓名,送達代收人住址,郵遞區號,清算人,變更原因,,
043年法                  字&nbsp;&nbsp;&nbsp;&nbsp;&nbsp;&nbsp;&nbsp;&nbsp;&nbsp;&nbsp;4號,財團,設立登記,000,2,043/03/26,043/04/15,043/04/16,1冊            2頁,,0,劉廣志,財團法人嘉義教會聚會所,043/04/15,嘉義市中正路八十三號,傳揚耶蘇基督真理經嘉義縣政府許可設立聲請為法人設立之登記,信徒劉廣志等七十六人捐助財產計有土地房屋桌椅等,嘉義縣政府嘉府民字第０三六一三代電核准,永久保存,93200,准許,043/04/16,043/04/17,,,,,,,
101年法登他              字&nbsp;&nbsp;&nbsp;&nbsp;&nbsp;&nbsp;&nbsp;&nbsp;90號,財團,變更登記,曾秀貞,3,101/09/13,101/09/19,101/09/20,1冊            3頁,2,11,吳振明,財團法人台灣省私立嘉義博愛仁愛之家,044/07/05,嘉義市林森東路235號,一、興辦社會福利救助事業，服務弱勢族群尊重生命價值與發揚人道精神。二、發展長期照護業務，協助失能者在生命餘光裡開創新價值，進而重燃對生活的希望。三、以機構式照護為基礎，結合社區資源推動社區照護，落實在地老化。,財產孳息、業務收入、地方捐贈、政府補助及其他收益撥充。,四十年六月三日十一月七日嘉義縣政府立案內政部備案,無限期,128036414,准許,101/09/19,,101/10/01,吳振明,嘉義市林森東路二三五號,600,,,
103年法登他              字&nbsp;&nbsp;&nbsp;&nbsp;&nbsp;&nbsp;&nbsp;&nbsp;&nbsp;&nbsp;1號,財團,變更登記,許龍崑,4,103/01/03,103/01/06,103/01/07,3冊            15頁,2,12,張南薰,財團法人台灣省私立嘉義仁愛之家,045/02/28,嘉義市吳鳳南路119號,依照老人福利法、身心障礙保護法、兒童及少年福利法、社會救助法、及社會福利相關法規，並視實際需要及財力狀況辦理下列各項事業：1、老人安養所２、老人養護所３、長期照護４、老人諮詢及服務事項５、社區型老人短期照護及喘息服務６、舉辦其他社會福利相關事業。,１、財產孳息２、業務收入３、政府補助４、捐款５、其他等收入,台灣省政府六五年五月二十日府社五字第三一三二六號,無限期,160325145.9,准許,103/01/06,,103/01/15,,,600,,,
099年法登他              字&nbsp;&nbsp;&nbsp;&nbsp;&nbsp;&nbsp;&nbsp;&nbsp;64號,財團,變更登記,陳朱貴,5,099/06/07,099/06/08,099/06/09,1冊            5頁,2,9,鍾安住,財團法人天主教會嘉義教區,045/05/03,嘉義市大雅路二段502號,宣揚天主教教義及辦理社會教育、慈善事業、醫療復健、教養、安養等。,由天主教會台灣教區與財團法人聖徒會移交及董事涂敏正捐助,四十五年三月十五日　台灣省政府肆伍府民一字第二七０二六號,無限期,728435018,准許,099/06/08,,099/06/21,李秋菊,嘉義市大雅路二段502號,600,,,



048年法                  字&nbsp;&nbsp;&nbsp;&nbsp;&nbsp;&nbsp;&nbsp;&nbsp;10號,財團,設立登記,楊與齡,9,048/05/23,048/06/04,048/06/07,1冊            9頁,,0,王雪亭,財團法人台灣糖業公司大林糖廠職工福利委員會,048/06/04,嘉義縣大林鎮大糖里三九九號,辦理職工福利事業,按職工薪工津提撥二．五％,四十二年八月二六日,無限期,410000,准許,048/06/04,,,,,,,,
047年法                  字&nbsp;&nbsp;&nbsp;&nbsp;&nbsp;&nbsp;&nbsp;&nbsp;&nbsp;&nbsp;3號,財團,設立登記,楊與齡,10,047/02/15,047/07/15,047/07/16,1冊            10頁,,0,王舜緒,財團法人台灣糖業公司蒜頭糖廠職工福利委員會,047/07/15,,辦理職工福利事業,,四十二年十一月二十八日,無限期,5950,准許,047/07/15,,,,,,,,
